{
  "$id": "https://sentinelx.local/contracts/v1/normalized-event.schema.json",
  "$schema": "https://json-schema.org/draft/2020-12/schema",
  "type": "object",
  "properties": {
    "schema_version": {
      "type": "string",
      "const": "v1"
    },
    "event_id": {
      "type": "string",
      "pattern": "^[A-Za-z0-9][A-Za-z0-9_.:-]{0,127}$"
    },
    "occurred_at": {
      "type": "string",
      "format": "date-time",
      "pattern": "^(?:(?:\\d\\d[2468][048]|\\d\\d[13579][26]|\\d\\d0[48]|[02468][048]00|[13579][26]00)-02-29|\\d{4}-(?:(?:0[13578]|1[02])-(?:0[1-9]|[12]\\d|3[01])|(?:0[469]|11)-(?:0[1-9]|[12]\\d|30)|(?:02)-(?:0[1-9]|1\\d|2[0-8])))T(?:(?:[01]\\d|2[0-3]):[0-5]\\d:[0-5]\\d(?:\\.\\d+)?(?:Z))$",
      "description": "UTC, ISO 8601 with Z"
    },
    "ingested_at": {
      "type": "string",
      "format": "date-time",
      "pattern": "^(?:(?:\\d\\d[2468][048]|\\d\\d[13579][26]|\\d\\d0[48]|[02468][048]00|[13579][26]00)-02-29|\\d{4}-(?:(?:0[13578]|1[02])-(?:0[1-9]|[12]\\d|3[01])|(?:0[469]|11)-(?:0[1-9]|[12]\\d|30)|(?:02)-(?:0[1-9]|1\\d|2[0-8])))T(?:(?:[01]\\d|2[0-3]):[0-5]\\d:[0-5]\\d(?:\\.\\d+)?(?:Z))$",
      "description": "UTC, ISO 8601 with Z"
    },
    "user_id": {
      "type": "string",
      "allOf": [
        {
          "pattern": "^[A-Za-z0-9][A-Za-z0-9_.@-]{0,127}$"
        },
        {
          "pattern": "^[^A-Z]*$"
        }
      ]
    },
    "source_ip": {
      "anyOf": [
        {
          "type": "string",
          "format": "ipv4",
          "pattern": "^(?:(?:25[0-5]|2[0-4][0-9]|1[0-9][0-9]|[1-9][0-9]|[0-9])\\.){3}(?:25[0-5]|2[0-4][0-9]|1[0-9][0-9]|[1-9][0-9]|[0-9])$"
        },
        {
          "type": "string",
          "format": "ipv6",
          "pattern": "^(([0-9a-fA-F]{1,4}:){7}[0-9a-fA-F]{1,4}|([0-9a-fA-F]{1,4}:){1,7}:|([0-9a-fA-F]{1,4}:){1,6}:[0-9a-fA-F]{1,4}|([0-9a-fA-F]{1,4}:){1,5}(:[0-9a-fA-F]{1,4}){1,2}|([0-9a-fA-F]{1,4}:){1,4}(:[0-9a-fA-F]{1,4}){1,3}|([0-9a-fA-F]{1,4}:){1,3}(:[0-9a-fA-F]{1,4}){1,4}|([0-9a-fA-F]{1,4}:){1,2}(:[0-9a-fA-F]{1,4}){1,5}|[0-9a-fA-F]{1,4}:((:[0-9a-fA-F]{1,4}){1,6})|:((:[0-9a-fA-F]{1,4}){1,7}|:))$"
        }
      ]
    },
    "event_type": {
      "type": "string",
      "enum": [
        "authentication",
        "process",
        "file_access",
        "privilege_change",
        "network"
      ]
    },
    "action": {
      "type": "string",
      "allOf": [
        {
          "pattern": "^[A-Za-z0-9_.-]{1,64}$"
        },
        {
          "pattern": "^[^A-Z]*$"
        }
      ]
    },
    "resource": {
      "type": "string",
      "minLength": 1,
      "maxLength": 512,
      "pattern": "^[^\\u0000-\\u001f\\u007f]+$"
    },
    "status": {
      "type": "string",
      "enum": [
        "success",
        "failed"
      ]
    },
    "metadata": {
      "type": "object",
      "propertyNames": {
        "type": "string",
        "minLength": 1,
        "maxLength": 64
      },
      "additionalProperties": {},
      "description": "Free-form JSON object, keys 1-64 chars, serialized size <= 4096 bytes."
    }
  },
  "required": [
    "schema_version",
    "event_id",
    "occurred_at",
    "ingested_at",
    "user_id",
    "source_ip",
    "event_type",
    "action",
    "resource",
    "status",
    "metadata"
  ],
  "additionalProperties": false,
  "title": "SentinelX normalized security event (Kafka message) v1"
}
